<?xml version="1.0" encoding="UTF-8"?>
<!-- editado con XMLSpy v2020 sp1 (x64) (http://www.altova.com) por  (University of the Basque Country) -->
<!-- edited with XMLSpy v2020 (http://www.altova.com) by  (University of the Basque Country) -->
<TypeOfProduct xmlns="ManufacturingPlan" productType="4" refRecipe="recipe02" description="Elaborated Product IPB" xmlns:xsi="http://www.w3.org/2001/XMLSchema-instance" xsi:schemaLocation="ManufacturingPlan ../TypeOfProduct.xsd">
	<action id="1" type="pick_and_place" description="robot moving piece"/>
	<TypeOfProduct productType="IPB_4" description="Industrial Plastic Base 4">
		<action id="3" type="indexing" description="indexing process"/>
		<TypeOfProduct productType="IPB_3" description="Industrial Plastic Base 3">
			<action id="1" type="pick_and_place" description="robot moving piece"/>
			<TypeOfProduct productType="IPB_2" description="Industrial Plastic Base 2">
				<action id="2" type="punching" description="punching process"/>
				<TypeOfProduct productType="IPB_1" description="Industrial Plastic Base 1">
					<action id="1" type="pick_and_place" description="robot moving piece"/>
					<TypeOfProduct productType="IPB" description="Industrial Plastic Base">
						<rawMaterial id="IPB" description="Industrial Plastic Base"/>
					</TypeOfProduct>
				</TypeOfProduct>
			</TypeOfProduct>
		</TypeOfProduct>
	</TypeOfProduct>
</TypeOfProduct>
