<?xml version="1.0" encoding="UTF-8"?>
<!-- editado con XMLSpy v2020 sp1 (x64) (http://www.altova.com) por  (University of the Basque Country) -->
<!-- edited with XMLSpy v2020 (http://www.altova.com) by  (University of the Basque Country) -->
<TypeOfProduct xmlns="ManufacturingPlan" productType="SP1" refRecipe="recipe03" description="Small product 1" xmlns:xsi="http://www.w3.org/2001/XMLSchema-instance" xsi:schemaLocation="ManufacturingPlan ../TypeOfProduct.xsd">
	<action id="8" type="pick_and_place" description="place cover"/>
	<TypeOfProduct productType="SB_B2" description="SB_A + upper bearing">
		<action id="7" type="insert" description="insert upper bearing"/>
		<TypeOfProduct productType="SB_A" description="SB_B + axis">
			<action id="6" type="insert" description="insert axis"/>
			<TypeOfProduct productType="SB_B" description="SB + lower bearing">
				<action id="5" type="insert" description="insert lower bearing"/>
				<TypeOfProduct productType="SB" description="Small base">
					<rawMaterial id="SB" description="Small base"/>
				</TypeOfProduct>
			</TypeOfProduct>
		</TypeOfProduct>
	</TypeOfProduct>
</TypeOfProduct>
